{
  "$schema": "./PlaywrightGrid.schema.json",
  "enabled": true,
  "server": {
    "url": "https://grid.agenix.com",
    "project": "default_project",
    "apiKey": "aa19555c-c9ce-42eb-bb11-87757225d535"
  },
  "launch": {
    "name": "Demo Launch",
    "description": "This is a demonstration launch showing the configuration capabilities",
    "attributes": [
      "t1",
      "t2",
      "platform:x64",
      "env:development"
    ]
  },
  "suite": {
    "name": "Default Suite",
    "description": "Default suite configuration",
    "attributes": [
      "smoke",
      "regression"
    ]
  },
  "testRun": {
    "defaultLabelKey": "MyApp:Chromium:UAT:US-East",
    "attributes": [
      "automated",
      "priority:high"
    ]
  },
  "timeout": {
    "seconds": 30
  },
  "retry": {
    "count": 3,
    "delaySeconds": 2
  },
  "concurrency": {
    "maxConcurrentRequests": 10
  }
}
